{
  "schema": "tessera.audit-policy/1",
  "period_ns": 86400000000000,
  "buckets": [
    {"max_tokens": 1024, "rate": "0.1"},
    {"max_tokens": 16384, "rate": "0.02"},
    {"max_tokens": 131072, "rate": "0.004"}
  ],
  "min_batch_tokens": 16384,
  "max_batch_tokens": 262144,
  "proof_deadline_ns": 604800000000000,
  "params": "live-64/1"
}
